,Unnamed: 0,country,description,designation,points,price,province,region_1,region_2,taster_name,taster_twitter_handle,title,variety,winery,Wine Year
2612,2612,US,"This is a blend of 67% Syrah and 33% Cabernet Sauvignon from Red Willow and Dineen, respectively. Though it falls on the lighter side for Washington Syrah, it's proportionate and pleasing, with strawberry fruit, mocha and toast. Tannins are fine and slender; though drinking well now, this could be cellared for awhile longer.",2 Spires,90,34.0,Washington,Columbia Valley (WA),Columbia Valley,Paul Gregutt,@paulgwine ,William Church 2010 2 Spires Syrah-Cabernet Sauvignon (Columbia Valley (WA)),Syrah-Cabernet Sauvignon,William Church,2010
2644,2644,US,"All black cherry and blueberry jam, this South Coast Syrah is fruity and spicy, full and fleshy with pepper and cinnamon spice and a teaspoon of black tea playfully showing through. Consistent throughout, a wine that's easy to like and complex at the same time. It spent close to two years in French oak, 30% of it new.",Vista Del Monte Vineyard,89,44.0,California,Temecula Valley,South Coast,Virginie Boone,@vboone,Leonesse Cellars 2008 Vista Del Monte Vineyard Syrah (Temecula Valley),Syrah,Leonesse Cellars,2008
2649,2649,US,"Broadly fruity, this dark and smooth Merlot is loaded with a luscious mix of black fruits. The flavors play out in forward, accessible fashion, flecked with a pleasing minerality.",The Tusk Elephant Mountain Vineyard,89,50.0,Washington,Yakima Valley,Columbia Valley,Paul Gregutt,@paulgwine ,O•S Winery 2009 The Tusk Elephant Mountain Vineyard Merlot (Yakima Valley),Merlot,O•S Winery,2009
2650,2650,US,"Spicy and bright, with an almost-too-ripe note to the fruit. Sweet ripe berries are joined by hints of sweet tomato and fecund, autumnal flavors, suggesting that this Syrah should be consumed sooner rather than later.",Ex Umbris,89,24.0,Washington,Columbia Valley (WA),Columbia Valley,Paul Gregutt,@paulgwine ,Owen Roe 2009 Ex Umbris Syrah (Columbia Valley (WA)),Syrah,Owen Roe,2009
2663,2663,US,"Conflict is two thirds Cabernet Sauvignon, 25% Merlot, and 8% Cabernet Franc. Smoke wreathes around deep cherry candy flavors, leading into some chewy tannins dusted with savory herbs.",Conner Lee Vineyard Conflict,90,55.0,Washington,Columbia Valley (WA),Columbia Valley,Paul Gregutt,@paulgwine ,J. Bookwalter 2010 Conner Lee Vineyard Conflict Red (Columbia Valley (WA)),Bordeaux-style Red Blend,J. Bookwalter,2010
2664,2664,US,"This lush Chardonnay has a certain oiliness to the aromas, along with dusty, toasty components that ride through a soft, plush mid-palate. The fruit is a rich mix of peach and apricot, highlighted with toasted hazelnuts, vanilla and coconut.",Cold Creek Vineyard,90,30.0,Washington,Columbia Valley (WA),Columbia Valley,Paul Gregutt,@paulgwine ,Januik 2011 Cold Creek Vineyard Chardonnay (Columbia Valley (WA)),Chardonnay,Januik,2011
2675,2675,US,"This is 89% Cabernet Sauvignon, 8% Merlot and 3% Syrah. It's toasty to the max, with scents and flavors of coffee and smoke as much as berry and cassis. There is great acid/tannin balance and some additional years of bottle age should help to bring out more of the fruit.",Foreshadow,90,45.0,Washington,Columbia Valley (WA),Columbia Valley,Paul Gregutt,@paulgwine ,J. Bookwalter 2010 Foreshadow Cabernet Sauvignon (Columbia Valley (WA)),Cabernet Sauvignon,J. Bookwalter,2010
2678,2678,US,"This wine is mostly Sémillon, with Sauvignon Blanc filling in the rest. It's one of the rare white wines from the Walla Walla AVA, graceful, full-bodied and tasting of fig and green banana. Just recently bottled, it still carries a bit of yeast in the nose and in the finish. Give it another few months to pull itself together.",Seven Hills Vineyard Estate Luminesce,90,20.0,Washington,Walla Walla Valley (WA),Columbia Valley,Paul Gregutt,@paulgwine ,L'Ecole No. 41 2012 Seven Hills Vineyard Estate Luminesce Semillon-Sauvignon Blanc (Walla Walla Valley (WA)),Semillon-Sauvignon Blanc,L'Ecole No. 41,2012
2686,2686,US,"This 95% Cabernet Sauvignon with the balance of Merlot, Syrah and Malbec, is immediately accessible with notes of char, roasted coffee bean and cherry. The palate is rich, chocolaty and seamlessly stitched together.",Canoe Ridge Estate,90,30.0,Washington,Horse Heaven Hills,Columbia Valley,Sean P. Sullivan,@wawinereport,Chateau Ste. Michelle 2010 Canoe Ridge Estate Cabernet Sauvignon (Horse Heaven Hills),Cabernet Sauvignon,Chateau Ste. Michelle,2010
2727,2727,US,"In many ways, this is a fascinating sip, but the components are a bit confusing altogether. Aromas of minty berries, tobacco, rustic leather and a very strong camphor scent introduce the nose, and then a lively, quite foamy acidity consumes the palate, where flavors of sweet berries are cut by garden herbs and pepper. It's a little too overpowering.",Old Vine,86,29.0,California,Cucamonga Valley,South Coast,Matt Kettmann,@mattkettmann,Joseph Filippi 2009 Old Vine Zinfandel (Cucamonga Valley),Zinfandel,Joseph Filippi,2009
2731,2731,US,"This medium-bodied wine is very fruity in aroma, and exudes ripe pear and fig flavors. Add in creamy vanilla accents and a very soft texture and the effect is almost sweet.",Jam's Blend,86,12.0,California,Lodi,Central Valley,Jim Gordon,@gordone_cellars,Tortoise Creek 2014 Jam's Blend Chardonnay (Lodi),Chardonnay,Tortoise Creek,2014
2733,2733,US,"This is a juicy and formidably tannic version of the variety, from a famed vineyard known also for Zinfandel. Dry oak and intrusively harsh texture need mellowing before the more gentle notions of dried herb and black cherry can shine.",Frediani Vineyard,86,70.0,California,Calistoga,Napa,Virginie Boone,@vboone,Vermeil 2013 Frediani Vineyard Cabernet Franc (Calistoga),Cabernet Franc,Vermeil,2013
2763,2763,US,"Fermented entirely in stainless steel, this is a simple, tropically sweet wine, characterized by mango, pineapple and juicy melon.",Un-Oaked,84,13.0,California,Sonoma County,Sonoma,Virginie Boone,@vboone,River Road 2015 Un-Oaked Chardonnay (Sonoma County),Chardonnay,River Road,2015
2765,2765,US,"This full-bodied wine has earthy, woodsy aromas, ripe and mature fruit flavors and a broad, almost soft texture. It's very mouth-filling and smooth, and will please people who like a little rusticity in their wines.",Judy's Vineyard,84,29.0,California,Lodi,Central Valley,Jim Gordon,@gordone_cellars,Housley's Century Oak 2013 Judy's Vineyard Cabernet Sauvignon (Lodi),Cabernet Sauvignon,Housley's Century Oak,2013
2770,2770,US,"Rather vegetal aromas of jalapeño and bell pepper mix with red fruit on the nose of this bottling. Those same bell peppery notes carry through the palate, which is intriguing but will likely confuse many drinkers.",Serena's Private Reserve,84,26.0,California,Paso Robles,Central Coast,Matt Kettmann,@mattkettmann,Four Sisters Ranch 2011 Serena's Private Reserve Cabernet Sauvignon (Paso Robles),Cabernet Sauvignon,Four Sisters Ranch,2011
2771,2771,US,This is a simple representation of the variety: medium in acidity and weight and a roundness of appropriate apple and pear that finishes flat.,Reserve,84,20.0,California,Russian River Valley,Sonoma,Virginie Boone,@vboone,Frei Brothers 2014 Reserve Chardonnay (Russian River Valley),Chardonnay,Frei Brothers,2014
2786,2786,US,This crisp Chardonnay has a disjointedness about it. Its aroma and flavor is most akin to Lemonheads candy.,Old Head,84,15.0,California,Dunnigan Hills,Central Valley,Virginie Boone,@vboone,Matchbook 2010 Old Head Chardonnay (Dunnigan Hills),Chardonnay,Matchbook,2010
2807,2807,US,"This unusual wine offers aromas of nori, dried flowers, bittersweet chocolate and cherry cola. It's full flavored with a lightly tacky feel.",Wallula Vineyard,87,60.0,Washington,Horse Heaven Hills,Columbia Valley,Sean P. Sullivan,@wawinereport,Boudreaux Cellars 2011 Wallula Vineyard Syrah (Horse Heaven Hills),Syrah,Boudreaux Cellars,2011
2808,2808,US,"Cherry, raspberry and vanilla combine for an inviting mix of ripeness and sweet bouquet. A fruity component also sits nicely atop this structured wine marked by soft, fine tannins. The finish is robust in black pepper and clove.",Signature Series,87,15.0,California,Oakville,Napa,Virginie Boone,@vboone,Kirkland Signature 2013 Signature Series Merlot (Oakville),Merlot,Kirkland Signature,2013
2811,2811,US,"This wine displays generous aromas of white pepper, woodspice, raspberry and cherry. The flavors are elegant with a peppery finish.",Verhey Vineyard,87,30.0,Washington,Yakima Valley,Columbia Valley,Sean P. Sullivan,@wawinereport,:Nota Bene 2011 Verhey Vineyard Malbec (Yakima Valley),Malbec,:Nota Bene,2011
2812,2812,US,"Robust and brawny, this substantial offering features concentrated layers of smoke, leather and sage-inflected tannins. It finishes in a wrapping of bittersweet chocolate.",Estate Grown and Produced,87,25.0,California,Oakville,Napa,Virginie Boone,@vboone,Oakville Winery 2013 Estate Grown and Produced Zinfandel (Oakville),Zinfandel,Oakville Winery,2013
2814,2814,US,"This blend of Merlot, Cabernet Sauvignon, Cabernet Franc, Petit Verdot and Syrah shows a somewhat uneasy mix of woodspice, green herb and cherry aromas. Flavors are pleasant, lighter in style and easy drinking, with a refreshing finish.",La Vie en Rouge,86,14.0,Washington,Columbia Valley (WA),Columbia Valley,Sean P. Sullivan,@wawinereport,Kennedy Shah 2012 La Vie en Rouge Red (Columbia Valley (WA)),Red Blend,Kennedy Shah,2012
2816,2816,US,"This is Provence pink in color—light and just slightly shaded with copper. It smells floral and fruity, like watermelon, canteloupe and cucumber. The balance is on the sweet side, lending a softness in texture.",Belle en,86,18.0,California,Amador County,Sierra Foothills,Jim Gordon,@gordone_cellars,Andis 2014 Belle en Rosé (Amador County),Rosé,Andis,2014
2819,2819,US,"A 100% varietal wine, this opens in floral violet perfume, delicate notions that are soon overpowered by the chock-a-block blackberry and plum. The tannins are robust and still integrating, giving the wine a somewhat harsh feel.",Unfiltered,86,35.0,California,Calistoga,Napa,Virginie Boone,@vboone,Barlow 2012 Unfiltered Merlot (Calistoga),Merlot,Barlow,2012
2848,2848,US,The flower and peach aromas are quite subdued for the variety. The stone-fruit flavors provide more generosity while still displaying elegance.,Barrel Select,88,24.0,Washington,Columbia Valley (WA),Columbia Valley,Sean P. Sullivan,@wawinereport,Hawkins Cellars 2015 Barrel Select Viognier (Columbia Valley (WA)),Viognier,Hawkins Cellars,2015
2857,2857,US,"This wine is made in a ripe forward style, with lightly volatile aromas of apple, plum and dark raspberries. It's full bodied and pulls no punches as generous red and black-fruit flavors with cocoa accents show some warmth on the finish.",Reserve Northridge Vineyard,88,35.0,Washington,Wahluke Slope,Columbia Valley,Sean P. Sullivan,@wawinereport,Ryan Patrick 2013 Reserve Northridge Vineyard Grenache (Wahluke Slope),Grenache,Ryan Patrick,2013
2863,2863,US,"A mild current of cinnamon, clove and tobacco provide a spicy entry into this wine, backed up by a fruity mid-palate. Medium weight and body give it some power and substance, while on the finish, it comes under an herbaceous light.",Reserve,88,27.0,California,Dry Creek Valley,Sonoma,Virginie Boone,@vboone,Vanderbilt 2013 Reserve Merlot (Dry Creek Valley),Merlot,Vanderbilt,2013
2865,2865,US,"One of the best Stoller Vineyard designates from anywhere, this bright and spicy effort is bursting with flavors of red currants, accented with smoky chocolate. Tannins are fine tuned and the wine has excellent balance throughout.",Stoller Vineyard,91,30.0,Oregon,Dundee Hills,Willamette Valley,Paul Gregutt,@paulgwine ,Purple Hands 2011 Stoller Vineyard Pinot Noir (Dundee Hills),Pinot Noir,Purple Hands,2011
2879,2879,US,"This is done in an open, palate-friendly style, with rich, generous black fruits accented with cocoa, coffee and caramel. There's a streak of vanilla custard also, and the fruit has enough depth and mass to hold up through a satisfying finish.",Benchmark,91,29.0,Washington,Columbia Valley (WA),Columbia Valley,Paul Gregutt,@paulgwine ,Market Vineyards 2009 Benchmark Merlot (Columbia Valley (WA)),Merlot,Market Vineyards,2009
2900,2900,US,"A faint hint of pink shines on this sparkler named after the winery owners' dog. Aromas of fresh melon and slight peach lead to a faint cherry note upon sipping and creamy mouthfeel, followed by plum skin tartness and a yeasty, sour bitterness.",Amber's Cuvee,86,40.0,California,Santa Cruz Mountains,Central Coast,Matt Kettmann,@mattkettmann,Clos La Chance 2010 Amber's Cuvee Sparkling (Santa Cruz Mountains),Sparkling Blend,Clos La Chance,2010
2906,2906,US,"Vibrantly fruity, it offers aromas of currant, raspberry, celery stalk and spice. The palate has tart cranberry flavors, finishing a bit short.",Maple Ranch Estate,86,35.0,Oregon,Rogue Valley,Southern Oregon,Sean P. Sullivan,@wawinereport,Foris 2012 Maple Ranch Estate Pinot Noir (Rogue Valley),Pinot Noir,Foris,2012
2915,2915,US,"Soft and supple, this has a heavy streak of spearmint and an herbal finish that also offers dark black cherry and ripe, leathery tannins.",Siebert Ranch,86,40.0,California,Russian River Valley,Sonoma,Virginie Boone,@vboone,Ancient Oak Cellars 2011 Siebert Ranch Pinot Noir (Russian River Valley),Pinot Noir,Ancient Oak Cellars,2011
2917,2917,US,"This is a fairly light, bright Pinot Noir with the marks of a ripe year and time spent in oak. It is crafted under the guidelines of a certified sustainable grape growing program. Medium-bodied and juicy, it's fairly priced and ready to enjoy now.",Appellation Series,86,29.0,California,Sonoma Coast,Sonoma,Virginie Boone,@vboone,Benziger 2012 Appellation Series Pinot Noir (Sonoma Coast),Pinot Noir,Benziger,2012
2948,2948,US,"This vineyard has proven it can ripen good Malbec, but here it seems as if something has gone sideways. There is a gluey scent underneath the blackberry fruit, and the wine seems chalky and disjointed in the mouth, with more of the band-aid flavors in the finish.",Estate,83,26.0,Washington,Wahluke Slope,Columbia Valley,Paul Gregutt,@paulgwine ,Gilbert Cellars 2007 Estate Malbec (Wahluke Slope),Malbec,Gilbert Cellars,2007
2950,2950,US,"This is a pretty wine, and the initial flavors are soft and mature, suggesting a wine that's ready to drink now. In the mouth it falls away quickly with a slightly oxidized character that suggests an early fade is on the way. It's gentle and drinks well enough right now, with some barrel notes of caramel and coffee beefing up the finish.",Nicholas Estate,86,30.0,Oregon,Willamette Valley,Willamette Valley,Paul Gregutt,@paulgwine ,Anam Cara 2005 Nicholas Estate Pinot Noir (Willamette Valley),Pinot Noir,Anam Cara,2005
2951,2951,US,"An exotic bouquet suggests dried roses, brown sugar, cranberry and plum jam. There's a sweetness in the mouth that continues the impression of brown sugar, or maybe a streak of cola. It's an interesting bottle that could develop further or fall off a cliff; it turns a little funky in the finish. More than 12,000 cases were made.",Premier Cuvée,86,37.0,Oregon,Dundee Hills,Willamette Valley,Paul Gregutt,@paulgwine ,Archery Summit 2004 Premier Cuvée Pinot Noir (Dundee Hills),Pinot Noir,Archery Summit,2004
2967,2967,US,"A light entry holds flavors of strawberry and tomato leaf, then turns tannic. Chewy and earthy, with more than a hint of seed and stem, this wine comes from biodynamically farmed grapes that add some earthy nuances, but put too much emphasis on green tea, stemmy flavors.",Renegade Ridge Estate,85,75.0,Oregon,Dundee Hills,Willamette Valley,Paul Gregutt,@paulgwine ,Archery Summit 2004 Renegade Ridge Estate Pinot Noir (Dundee Hills),Pinot Noir,Archery Summit,2004
2983,2983,US,"This thick, concentrated wine offers complex notions of sandalwood and soapstone, savory in pleasant ways. Clove accents the warmth of strawberry compote laced in rhubarb.",Orsi Vineyard,91,30.0,California,Russian River Valley,Sonoma,Virginie Boone,@vboone,Miro 2014 Orsi Vineyard Pinot Noir (Russian River Valley),Pinot Noir,Miro,2014
2984,2984,US,"An attractive, oaky perfume and melt-in-the-mouth fruit and dark-chocolate flavors make this full-bodied wine hard to resist. It has a luscious, mouth-coating texture, beautifully ripe blackberries and cherries, and a lingering finish.",The Spur,91,30.0,California,Livermore Valley,Central Coast,Jim Gordon,@gordone_cellars,Murrieta's Well 2013 The Spur Red (Livermore Valley),Red Blend,Murrieta's Well,2013
2986,2986,US,"Although one of the cheaper Zins in the winery's line-up, it is showing the best right now, so drink up. Black cherry, licorice, smoked beef and a deep hibiscus note make for a very heady nose. There is a dense yet soft character to the well-structured palate, where strong flavors of blueberry, crushed slate, tobacco, leather and wild herbs make a tasty convergence.",Summit Creek,91,19.0,California,Paso Robles,Central Coast,Matt Kettmann,@mattkettmann,Opolo 2014 Summit Creek Zinfandel (Paso Robles),Zinfandel,Opolo,2014
2989,2989,US,"This sensational effort was fermented and briefly aged in neutral oak. The striking package sets it apart from all other Rex Hill wines, and the rich, complex flavors add to the impression that this is something truly special. Red berries, blood orange, a touch of Grand Marnier, impressive body and spicy highlights all combine in a darn near irresistible rosé with the power to be a four season wine.",Pinot Noir,91,24.0,Oregon,Willamette Valley,Willamette Valley,Paul Gregutt,@paulgwine ,Rex Hill 2015 Pinot Noir Rosé (Willamette Valley),Rosé,Rex Hill,2015
2990,2990,US,"This rich, rewarding wine pleases in baked blueberry pie and a taste of raisin cake, its texture underlined in soft, integrated oak and a velvety density. Cinnamon, black pepper and toffee weave within the waves of ripeness.",Founding Farmers,91,32.0,California,Napa Valley,Napa,Virginie Boone,@vboone,Robert Biale 2014 Founding Farmers Zinfandel (Napa Valley),Zinfandel,Robert Biale,2014
2991,2991,US,"The vineyard source for this tasty wine is farmed by a fifth-generation Japanese-American originally from California's Central Valley. Tightly wound in oak and tannin, it opens pleasantly to reveal a wealth of rose petals, earth and youthful ripe, dark cherry. With moderate acidity and body, it lingers on the palate.",Umino Vineyard,91,48.0,California,Russian River Valley,Sonoma,Virginie Boone,@vboone,Spell 2014 Umino Vineyard Pinot Noir (Russian River Valley),Pinot Noir,Spell,2014
2994,2994,US,"A fresh-baked bread aroma and flavors like butter and baking spices make this full-bodied wine very attractive. It has ample acidity to balance the rich texture, and a lingering finish that completes the classic profile.",Pahlmeyer,91,50.0,California,North Coast,North Coast,Jim Gordon,@gordone_cellars,Jayson 2013 Pahlmeyer Chardonnay (North Coast),Chardonnay,Jayson,2013
3006,3006,US,"Pamplin's admirable focus on its pair of Bordeaux-style blends is rather rare. This is the more expensive of the two, and a fine, fat, forward bottling in this warm vintage. It's three-quarters Cabernet Sauvignon, with lovely fruit that's compact upon opening, fleshing out with air time. Clean, dense and focused, it is bright with berry and cassis flavors, plus subtle barrel notes.",Proprietary Red,93,55.0,Washington,Columbia Valley (WA),Columbia Valley,Paul Gregutt,@paulgwine ,Pamplin 2009 Proprietary Red Red (Columbia Valley (WA)),Bordeaux-style Red Blend,Pamplin,2009
3013,3013,US,"This is pure single-vineyard Syrah, dark and tasting of cassis and blackberry, with a slightly briny, oyster-shell undercurrent. As it breathes, it displays a cured meat flavor, with a lively, citrusy finish accented by espresso.",Les Collines Vineyard,92,34.0,Washington,Walla Walla Valley (WA),Columbia Valley,Paul Gregutt,@paulgwine ,Amavi 2010 Les Collines Vineyard Syrah (Walla Walla Valley (WA)),Syrah,Amavi,2010
3018,3018,US,"This Merlot-dominated blend features juicy berry flavors and tart, citrusy acids. It has gentle details of pepper, herb, lemon verbena and orange peel. It's a pleasure to see more elegant complexity in these latest Spring Valley reds.",Uriah Estate Grown Red Wine,92,50.0,Washington,Walla Walla Valley (WA),Columbia Valley,Paul Gregutt,@paulgwine ,Spring Valley Vineyard 2009 Uriah Estate Grown Red Wine Red (Walla Walla Valley (WA)),Bordeaux-style Red Blend,Spring Valley Vineyard,2009
3022,3022,US,"“Rhône times three” seems to be the code name for this classy blend of Grenache, Mourvèdre and Syrah. It takes the best from each grape, creating a rich, pure, high-acid wine with a zingy berry flavor, plus a mineral underpinning and earthy, coffee-soaked tannins.",Rx-3 Red Wine,92,30.0,Washington,Columbia Valley (WA),Columbia Valley,Paul Gregutt,@paulgwine ,Nefarious 2010 Rx-3 Red Wine Red (Columbia Valley (WA)),Rhône-style Red Blend,Nefarious,2010
3023,3023,US,"Styled after the great white wines of Bordeaux, this is fresh and clean, with luscious mixed fruit flavors that emphasize apple and melon. A cooler vintage has produced a wine of low alcohol and real finesse, with a light dusting of toasty oak. Given its impeccable balance, it could be cellared for another 6–8 years.",Chaleur Estate Blanc,92,37.0,Washington,Columbia Valley (WA),Columbia Valley,Paul Gregutt,@paulgwine ,DeLille 2011 Chaleur Estate Blanc Sauvignon Blanc-Semillon (Columbia Valley (WA)),Sauvignon Blanc-Semillon,DeLille,2011
3024,3024,US,"A blend of 58% Syrah, 38% Cabernet Sauvignon and 4% Mourvèdre, this combinins power with a big yum factor. Potent and rich, with woody, spicy highlights, the juicy fruit flavors favor blackberry and black cherry. A whiff of smoke runs through the finish.",Aix,92,37.0,Washington,Red Mountain,Columbia Valley,Paul Gregutt,@paulgwine ,Doyenne 2009 Aix Red (Red Mountain),Red Blend,Doyenne,2009
3035,3035,US,"This wine offers perfumed aromas of clove, blue fruit, orange peel, toast and wild flowers. The flavors show restraint, with fruit and barrel flavors lingering on the finish.",Falcon Series Estate,88,25.0,Washington,Yakima Valley,Columbia Valley,Sean P. Sullivan,@wawinereport,Kestrel 2012 Falcon Series Estate Syrah (Yakima Valley),Syrah,Kestrel,2012
3036,3036,US,"Aromas of raspberry and herb intermingle on the nose, which also shows a touch of reduction. The palate offers soft tart fruit flavors that provide appeal.",Falcon Series,88,25.0,Washington,Yakima Valley,Columbia Valley,Sean P. Sullivan,@wawinereport,Kestrel 2012 Falcon Series Merlot (Yakima Valley),Merlot,Kestrel,2012
3041,3041,US,"Aromas of mineral, flowers and freshly cut green apple are followed by a just off-dry, lightly spritzy palate full of stone-fruit flavors.",Traditions Evergreen Vineyard,88,13.0,Washington,Ancient Lakes,Columbia Valley,Sean P. Sullivan,@wawinereport,Milbrandt 2015 Traditions Evergreen Vineyard Riesling (Ancient Lakes),Riesling,Milbrandt,2015
3048,3048,US,"Warm yellow apple, light custard and white peach combine for a creamy nose on this bottling from the Riboli family's new estate vineyard. The sip starts with a sizzle of acidity and then shows flavors of caramelized green apples and a touch of banana, proving both a tad tart and a tad rich.",Stefano Vineyard,88,20.0,California,Paso Robles,Central Coast,Matt Kettmann,@mattkettmann,San Simeon 2015 Stefano Vineyard Viognier (Paso Robles),Viognier,San Simeon,2015
3052,3052,US,"This blend of Cabernet Sauvignon, Merlot and Malbec is a steal, offering a robust touch of char on the front end aromatically before unleashing bright red fruit and soft tannin. Ultimately light bodied, it retains just the right amount of grippy tannin to give it some bite.",Top Rail,88,16.0,California,Sonoma County,Sonoma,Virginie Boone,@vboone,Picket Fence 2014 Top Rail Red (Sonoma County),Red Blend,Picket Fence,2014
3054,3054,US,"This perfumed expression of 60% Cabernet Sauvignon and 40% Merlot shows a great depth of complexity and deliciousness for the price. Firm, grippy tannin stars alongside dark cherry, currant, clove and tobacco, all along a softened layering of texture.",Taken,88,40.0,California,Napa Valley,Napa,Virginie Boone,@vboone,Taken Wine Co. 2014 Taken Red (Napa Valley),Bordeaux-style Red Blend,Taken Wine Co.,2014
3059,3059,US,"The aromas are light, with notes of freshly cut apple and spice. It drinks dry with elegantly styled fruit flavors that linger on the finish. It shows a very pretty styling.",Atavus Vineyard,88,27.0,Washington,Columbia Gorge (WA),Washington Other,Sean P. Sullivan,@wawinereport,Analemma 2014 Atavus Vineyard Gewürztraminer (Columbia Gorge (WA)),Gewürztraminer,Analemma,2014
3060,3060,US,"Light strawberry fruit with tart acidity carries a wine of modest proportions. It's drinking well, and might be a good choice for a simple salmon preparation, as it would not overwhelm the fish. The finishing tannins have a definite herbal flavor.",Nuthouse,88,50.0,Oregon,Eola-Amity Hills,Willamette Valley,Paul Gregutt,@paulgwine ,Argyle 2014 Nuthouse Pinot Noir (Eola-Amity Hills),Pinot Noir,Argyle,2014
3064,3064,US,"Consistent year after year, this blend of 67% Sauvignon Blanc and 33% Sémillon is modeled after top-flight white Bordeaux. Deep gold, toasty and scented with olive oil, walnuts and loam, it hits the palate full-on with a rainbow of flavors: citrus, stone and tropical fruits, all accented with toast, oil and nuts from barrel aging. Riveting, delicious  and unique.",Chaleur Estate Blanc,95,36.0,Washington,Columbia Valley (WA),Columbia Valley,Paul Gregutt,@paulgwine ,DeLille 2009 Chaleur Estate Blanc White (Columbia Valley (WA)),Bordeaux-style White Blend,DeLille,2009
