,Unnamed: 0,country,description,designation,points,price,province,region_1,region_2,taster_name,taster_twitter_handle,title,variety,winery,Wine Year
5209,5209,US,"The producer continues to impress with this estate Russian River white, an impressive ambassador for the region in its exuberant layers of apricot, honey and vanilla. The substantial texture and concentration stand out and add complexity. A lift of lemon meringue and spice complete the finish.",Estate,92,39.0,California,Russian River Valley,Sonoma,Virginie Boone,@vboone,Fog Crest 2012 Estate Chardonnay (Russian River Valley),Chardonnay,Fog Crest,2012
5210,5210,US,"Silky carpets of cherry grenadine invite one into this vineyard-designate, framed by seductive streaks of herbes de Provence and earthy black tea. Juicy and generous on the palate, the wine is also complex and restrained, its finish wrapped in toasty, subtle oak.",Bacigalupi Vineyard,92,60.0,California,Russian River Valley,Sonoma,Virginie Boone,@vboone,Gary Farrell 2012 Bacigalupi Vineyard Pinot Noir (Russian River Valley),Pinot Noir,Gary Farrell,2012
5213,5213,US,"Still young and sappy, the tart raspberry and cherry fruit carries tangy highlights of citrus rind and wet stone. Clean and fresh, it's a perfectly balanced wine from a difficult vintage, and has the structure to age through 2021–2023.",Estate Riservata,92,45.0,Oregon,Chehalem Mountains,Willamette Valley,Paul Gregutt,@paulgwine ,Alloro 2011 Estate Riservata Pinot Noir (Chehalem Mountains),Pinot Noir,Alloro,2011
5215,5215,US,"Bergfeld is named for the winery's historic owner and the land he originally planted around the winery in 1873. Given to old-world airs, the wine is chalky in black fruit, tobacco and mocha, as well as soft, substantial tannins. Generous in juiciness and structure, it has an herbal quality on the finish.",Bergfeld,92,135.0,California,St. Helena,Napa,Virginie Boone,@vboone,Hall 2011 Bergfeld Cabernet Sauvignon (St. Helena),Cabernet Sauvignon,Hall,2011
5216,5216,US,"From a highly sought-after source of Cabernet, this is classically oaky and dusty, a sophisticated take on the grape, dense and soft in waves of black cherry. With medium weight that picks up steam on the milk-chocolate finish, it's an impressive sipper or worthy companion to steak and potatoes.",Morisoli Vineyard,92,125.0,California,Rutherford,Napa,Virginie Boone,@vboone,Hunt McKay 2011 Morisoli Vineyard Cabernet Sauvignon (Rutherford),Cabernet Sauvignon,Hunt McKay,2011
5217,5217,US,"Sourced from a so-called “mystery clone” that may have originally arrived in Charles Coury's suitcase back in 1964, this unique old-vine bottling offers exceptional details of dusty cocoa, baking spices, cola, minerals and iron filings. The brambly berry fruits are not at all overwhelmed, just balanced out with the structure for aging. Drink now through 2025.",Coury,92,60.0,Oregon,McMinnville,Willamette Valley,Paul Gregutt,@paulgwine ,Hyland 2012 Coury Pinot Noir (McMinnville),Pinot Noir,Hyland,2012
5218,5218,US,"Just one barrel was made of this reserve. At first the new oak shines through, then as it opens out the wood becomes less noticeable and a complex array of spice, stem and iron filings comes into play. The fruit is light and textural, showing hints of sassafras and even a whiff of petrol.",Select Whole Cluster,92,150.0,Oregon,McMinnville,Willamette Valley,Paul Gregutt,@paulgwine ,Hyland 2012 Select Whole Cluster Pinot Noir (McMinnville),Pinot Noir,Hyland,2012
5219,5219,US,"Flinty and austere, this is an elegant white wine crafted from 100% Musque clone, dancing in pear and grapefruit. The layered texture impressively stands out, riding the wave between creamy and lemony crisp with precision, opening the door for the wine to finish refreshingly.",Samantha's,92,30.0,California,Alexander Valley,Sonoma,Virginie Boone,@vboone,Lancaster 2013 Samantha's Sauvignon Blanc (Alexander Valley),Sauvignon Blanc,Lancaster,2013
5221,5221,US,"This Dundee Hills vineyard really shines in 2012, with multi-layered flavors of sweet, spicy, slightly candied fruits. Kirsch, orange peel, smoke and sandalwood play against each other, with a citrus kick to the underlying acidity. Bright and focused through a long finish, this is one to tuck away for a few years. Drink 2017–2025.",Meyer Vineyard,92,48.0,Oregon,Willamette Valley,Willamette Valley,Paul Gregutt,@paulgwine ,Lemelson 2012 Meyer Vineyard Pinot Noir (Willamette Valley),Pinot Noir,Lemelson,2012
5223,5223,US,"This sophisticated effort maxxes out the potent cherry fruit with plenty of barrel toast. Much like the winery's reserve, the cherries are matched to roasted walnut flavors, with a hint of chipotle.",Caroline's Cuvée,92,33.0,Oregon,Willamette Valley,Willamette Valley,Paul Gregutt,@paulgwine ,Vercingetorix VX 2012 Caroline's Cuvée Pinot Noir (Willamette Valley),Pinot Noir,Vercingetorix VX,2012
5224,5224,US,"Sweet and extra ripe, this pushes the peach and apricot fruit to a rich and focused center, and keeps the impact of new French oak at just 20%. Which is plenty, adding just enough sweet and toasty vanilla to the extended, rich finish.",Elton,92,45.0,Oregon,Eola-Amity Hills,Willamette Valley,Paul Gregutt,@paulgwine ,Willamette Valley Vineyards 2012 Elton Chardonnay (Eola-Amity Hills),Chardonnay,Willamette Valley Vineyards,2012
5228,5228,US,"This is a very approachable and tasty wine, especially for a grape that can be so tannic when young. Aromas of cola, chopped mint and cherries translate to a fruity and minty palate, with just enough tannins, a nice acidic spice and a bit of woodiness on the finish. It's very well measured.",Tantrum,92,42.0,California,Paso Robles,Central Coast,Matt Kettmann,@mattkettmann,Michael Gill Cellars 2012 Tantrum Tempranillo (Paso Robles),Tempranillo,Michael Gill Cellars,2012
5232,5232,US,"From a selection of vineyard sites and clones, this wine offers juicy acidity behind a wave of plummy red and black cherry, an earthy foundation keeping things real. Oak and tannins are well integrated, and plenty of clove flavor make for a spicy finish. This gets extra attention for the awesome label.",Small Town,91,50.0,California,Sonoma Coast,Sonoma,Virginie Boone,@vboone,Eric Kent 2013 Small Town Pinot Noir (Sonoma Coast),Pinot Noir,Eric Kent,2013
5233,5233,US,"A small-production blend of 86% Zinfandel with 14% Petite Sirah, this was aged over a year in a small percentage of new oak. Dry and structured, it's a celebration of chocolate, leather and blackberry, the fruit sizably ripe yet kept in check. Drink now through 2018.",Railyard,91,16.0,California,Alexander Valley,Sonoma,Virginie Boone,@vboone,Fidelity 2013 Railyard Zinfandel (Alexander Valley),Zinfandel,Fidelity,2013
5235,5235,US,"Plummy and tight, this wine comes from the Green Valley section of the Russian River Valley. Youthful, it hints at fierce acidity around delicately woven specks of mint, pine forest, rhubarb and clove. In the background, the region's classic cola cherry characteristic shows as well. Drink now through 2021.",Foray,91,44.0,California,Russian River Valley,Sonoma,Virginie Boone,@vboone,Bailiwick 2013 Foray Pinot Noir (Russian River Valley),Pinot Noir,Bailiwick,2013
5238,5238,US,"This behemoth is all gristle and power, voluptuously combining 44% Cabernet Sauvignon, 36% Malbec, 9% Petit Verdot, 5% Merlot, 4% Syrah and 2% Carmenere in a mad scientist's way. Velvety, it's beyond full-bodied in blackberry and chocolate, integrated in terms of oak, with a splash of black pepper and tobacco on the finish. Drink now through 2022.",Estate,91,70.0,California,Chalk Hill,Sonoma,Virginie Boone,@vboone,Chalk Hill 2012 Estate Red (Chalk Hill),Red Blend,Chalk Hill,2012
5243,5243,US,"Generous aromas like ripe berries and vanilla get this full-bodied wine off to a good start.Next, the flavors chime in with harmonious blackberry, black cherry and baking-spice notes. The texture is suave and nicely tannic, and a tasty, spicy effect lasts on the finish. The wine is made with 46% Merlot, plus Cabernet Franc, Cabernet Sauvignon and Malbec.",Crown Block,91,45.0,California,Livermore Valley,Central Coast,Jim Gordon,@gordone_cellars,Darcie Kent Vineyards 2012 Crown Block Red (Livermore Valley),Red Blend,Darcie Kent Vineyards,2012
5244,5244,US,"This wine is principally Merlot (57%) and Cabernet Sauvignon (33%) along with pinches of Cabernet Franc and Petit Verdot. Dark fruit, fresh herb and abundant barrel-spice aromas are followed by bountiful, restrained black-fruit flavors that carry through the finish.",D2,91,45.0,Washington,Columbia Valley (WA),Columbia Valley,Sean P. Sullivan,@wawinereport,DeLille 2013 D2 Red (Columbia Valley (WA)),Bordeaux-style Red Blend,DeLille,2013
5252,5252,US,"From a p of Sonoma Mountain exposed to the Petaluma Gap, this wine is spicy in cinnamon and cola, its oak profile reduced and intense. Roses and cherries provide the floral and the fruit around deeper, darker tendencies into Asian spice and black tea. Drink now through 2021.",Silver Pines Vineyard,91,44.0,California,Sonoma Mountain,Sonoma,Virginie Boone,@vboone,Bailiwick 2013 Silver Pines Vineyard Pinot Noir (Sonoma Mountain),Pinot Noir,Bailiwick,2013
5256,5256,US,"A 100% varietal wine from the winery property, certified organic to boot, this is classic in cedar, currant and a freshness of blackberry. Vibrant acidity on the palate balances out the tightness of new oak. It captures the dustiness known to the appellation as well.",Miljenko's Selection Estate Grown,91,90.0,California,Rutherford,Napa,Virginie Boone,@vboone,Grgich Hills 2012 Miljenko's Selection Estate Grown Cabernet Sauvignon (Rutherford),Cabernet Sauvignon,Grgich Hills,2012
5258,5258,US,"Aromas of blackberry, black currant, cinnamon and dark plum lead to high toned herbal, green olive, licorice and barrel spice grace notes. The black fruit flavors are forward and concentrated, with smoked meat on the finish.",The Deal Sundance,91,35.0,Washington,Wahluke Slope,Columbia Valley,Sean P. Sullivan,@wawinereport,K Vintners 2012 The Deal Sundance Syrah (Wahluke Slope),Syrah,K Vintners,2012
5259,5259,US,"Exotic, complex and vivid aromas, rich and fulfilling fruit flavors and a hefty structure form a great package in this full-bodied and extroverted wine. The winemaker allowed wild yeast and kept 30% whole clusters in the fermentation, then aged it in neutral barrels.",Estate Reserve,91,72.0,California,Sonoma Coast,Sonoma,Jim Gordon,@gordone_cellars,Kanzler 2013 Estate Reserve Pinot Noir (Sonoma Coast),Pinot Noir,Kanzler,2013
5268,5268,US,"Floral notes, as well as hints of lemon, pear and pineapple introduce this high-acid white. It's full-bodied on the palate, and intense and well integrated, with a finish that's delightfully spicy with ginger.",Estate Vineyard,88,28.0,California,El Dorado,Sierra Foothills,Virginie Boone,@vboone,David Girard 2012 Estate Vineyard Grenache Blanc (El Dorado),Grenache Blanc,David Girard,2012
5272,5272,US,"This 2011 Lola is light and creamy, with hints of buttered apple, from aging in 18% new French oak. It finishes soft, supple and lightly spiced.",Lola Evergreen Vineyard,88,30.0,Washington,Columbia Valley (WA),Columbia Valley,Paul Gregutt,@paulgwine ,Efeste 2011 Lola Evergreen Vineyard Chardonnay (Columbia Valley (WA)),Chardonnay,Efeste,2011
5287,5287,US,"Pleasing toasty notes greet your first sniff, followed by apple pie fruit flavors with hints of plum and banana. It's a light, creamy, easy-drinking confection.",Barrel Select,87,25.0,Washington,Columbia Valley (WA),Columbia Valley,Paul Gregutt,@paulgwine ,Vin du Lac 2012 Barrel Select Chardonnay (Columbia Valley (WA)),Chardonnay,Vin du Lac,2012
5288,5288,US,"Fermented with 30% whole clusters and aged 20 months in neutral French oak, this is a distinctive wine with notes reminiscent of sage along with white pepper, violets and a tinge of copper. Designed for the dinner table, the palate is lighter in style with tart acidity.",Gorgeous Syrah Destiny Ridge Vineyard,87,24.0,Washington,Horse Heaven Hills,Columbia Valley,Sean P. Sullivan,@wawinereport,W.T. Vintners 2010 Gorgeous Syrah Destiny Ridge Vineyard Syrah (Horse Heaven Hills),Syrah,W.T. Vintners,2010
5295,5295,US,"McCay is a producer to watch in Lodi and this wine is a perfect example of why. A blend of four different Zinfandels and Petite Sirah, it opens with a nose of baked blackberry clafouti with a bit of hazelnut and almond, a still-tight wine that with air shows a ton of structure and layered tannins.",Paisley,88,24.0,California,Lodi,Central Valley,Virginie Boone,@vboone,McCay Cellars 2008 Paisley Red (Lodi),Red Blend,McCay Cellars,2008
5313,5313,US,"Dusty and toasty aromas over sweet plum fruit, with a streak of mocha running sharply down the center. Svelt and open, yet still sharp and showing a little bite in the back.",Cuvée Orleans,88,40.0,Washington,Yakima Valley,Columbia Valley,Paul Gregutt,@paulgwine ,McCrea Cellars 2007 Cuvée Orleans Syrah (Yakima Valley),Syrah,McCrea Cellars,2007
5327,5327,US,"Cherries and chocolate are the hallmark of the Zins at Maryhill. The fruit is pretty and the chocolate smooth, certainly a crowd-pleasing style. The finish is clean and supple.",Proprietor's Reserve,87,30.0,Washington,Columbia Valley (WA),Columbia Valley,Paul Gregutt,@paulgwine ,Maryhill 2009 Proprietor's Reserve Zinfandel (Columbia Valley (WA)),Zinfandel,Maryhill,2009
5328,5328,US,"At first this comes across as being a bit heavy, yeasty and tight. With time, however, this should be full of bramble-fruit flavors. This is a well-crafted wine, with structure and elegance that should start to show in 3–5 years.",Methode Ancienne,87,30.0,California,El Dorado,Sierra Foothills,Virginie Boone,@vboone,Miraflores 2009 Methode Ancienne Syrah (El Dorado),Syrah,Miraflores,2009
5332,5332,US,"This is a fresh and forward effort that's based on all six Bordeaux grapes. It bears pretty plum and cherry flavors, with a chocolaty wash over the quick finish.",Sobra,87,20.0,Washington,Columbia Valley (WA),Columbia Valley,Paul Gregutt,@paulgwine ,Tertulia 2008 Sobra Red (Columbia Valley (WA)),Bordeaux-style Red Blend,Tertulia,2008
5346,5346,US,"Tighter blackberry and blueberry fruits meet with a touch of fennel on this nose of this appellation blend by Billy Wathen and Dick Dore. Flavors range from refreshing blackberry soda to root beer and cola, achieving a measure of elegance thanks to dill, tomato leaf and a tannic grip.",7200,89,38.0,California,Happy Canyon of Santa Barbara,Central Coast,Matt Kettmann,@mattkettmann,Foxen 7200 2012 7200 Cabernet Sauvignon (Happy Canyon of Santa Barbara),Cabernet Sauvignon,Foxen 7200,2012
5350,5350,US,"This is a really well-made, traditional and tasty wine with flavor complexity, nice balance and the kind of firm texture that pairs well with grilled and roasted meats. The fruit characteristics of the grape—cherry and cranberry—meld easily with a modest touch of spicy oak from aging in barrels.",1846,89,30.0,California,Livermore Valley,Central Coast,Jim Gordon,@gordone_cellars,Nottingham Cellars 2012 1846 Cabernet Sauvignon (Livermore Valley),Cabernet Sauvignon,Nottingham Cellars,2012
5360,5360,US,"All aged in single-use French oak, this offers pleasing nuances of corn on the cob, spice, mineral and chamomile. The prickly pear flavors are both elegantly styled and well balanced.",Celilo Vineyard,89,45.0,Washington,Columbia Gorge (WA),Washington Other,Sean P. Sullivan,@wawinereport,Ashan 2013 Celilo Vineyard Chardonnay (Columbia Gorge (WA)),Chardonnay,Ashan,2013
5362,5362,US,"This wine was barrel-aged for 36 months and saw additional time in bottle prior to release. It displays brooding aromas of vanilla, cranberry, cherry, woodspice and light meaty notes. The palate is densely packed with tart cranberry flavors backed by firm, somewhat dry tannins.",Reserve,89,45.0,Washington,Columbia Valley (WA),Columbia Valley,Sean P. Sullivan,@wawinereport,Flying Dreams 2011 Reserve Tempranillo (Columbia Valley (WA)),Tempranillo,Flying Dreams,2011
5373,5373,US,"Though this wine was aged in just 26% new oak (French and American), the wood makes the first impression. Aromas of caramel, coffee and vanilla extract fare are followed by dark fruit and spices. Flavors are rich, hedonistic and sweet, supported by firm, somewhat rustic tannins.",Reserve,89,30.0,Washington,Columbia Valley (WA),Columbia Valley,Sean P. Sullivan,@wawinereport,Castillo De Feliciana 2011 Reserve Tempranillo (Columbia Valley (WA)),Tempranillo,Castillo De Feliciana,2011
5376,5376,US,"Rich in leather and oak, with swirls of ripe red raspberry and blackberry cobbler, this is a big-boy Zinfandel with hair on its chest, a taste of vanilla on the finish.",Old Vine,85,16.0,California,Lodi,Central Valley,Virginie Boone,@vboone,Seven Deadly Zins 2011 Old Vine Zinfandel (Lodi),Zinfandel,Seven Deadly Zins,2011
5421,5421,US,"This wine has a bright cherry character in the aromas and flavors along with medium body and a dry, firm texture. Lighter than many of its peers, but still cloaked in lots of fine tannins, it will improve with time. Wait until 2020.",Ghielmetti Vineyard,88,28.0,California,Livermore Valley,Central Coast,Jim Gordon,@gordone_cellars,Fenestra 2012 Ghielmetti Vineyard Petite Sirah (Livermore Valley),Petite Sirah,Fenestra,2012
5422,5422,US,"Coming on stiff and herbal, the Croft needs some time and patience. There are not quite resolved streaks of citrus, cherries, earthy tannins and a touch of cocoa powder. Still a baby, this should improve over the next three to five years.",Croft Vineyard,88,43.0,Oregon,Willamette Valley,Willamette Valley,Paul Gregutt,@paulgwine ,Fullerton 2014 Croft Vineyard Pinot Noir (Willamette Valley),Pinot Noir,Fullerton,2014
5426,5426,US,"This nicely rich and rounded wine smells like vanilla and toasted bread. The flavors are ripe and black-cherry-like, with a hint of chocolate and baking spices that comes from oak. It's medium bodied and easy to like.",Cherokee Lane,88,12.0,California,Lodi,Central Valley,Jim Gordon,@gordone_cellars,Tortoise Creek 2013 Cherokee Lane Cabernet Sauvignon (Lodi),Cabernet Sauvignon,Tortoise Creek,2013
5428,5428,US,"This sports a blue label, to differentiate it from the winery's estate bottling. It's dark and toasty, with robust black-cherry fruit, along with strong notes of charcoal, espresso and vanilla. There's nothing subtle here, but should work well with Korean ribs.",Blue Label,88,20.0,Oregon,Applegate Valley,Southern Oregon,Paul Gregutt,@paulgwine ,Troon 2013 Blue Label Zinfandel (Applegate Valley),Zinfandel,Troon,2013
5432,5432,US,"Wonderful blackberry and ripe grape flavors fill up this big but smooth new wine under country-music star Zac Brown's label. It has a very dark color, jammy aromas, rather sweet flavors and a velvety texture with enough tannin to keep it appetizing.",Uncaged,88,20.0,California,North Coast,North Coast,Jim Gordon,@gordone_cellars,Z. Alexander Brown 2013 Uncaged Red (North Coast),Red Blend,Z. Alexander Brown,2013
5447,5447,US,"A juicy, jammy blend of 50% Sangiovese, 25% Cabernet Sauvignon, 17% Montepulciano and 8% Zinfandel sourced primarily from Contra Costa County that's packed with blue and blackberry fruit, tobacco and plum. Clean and bright with a chewy texture.",Super Alamedan,88,20.0,California,California,California Other,Virginie Boone,@vboone,Rock Wall 2010 Super Alamedan Red (California),Red Blend,Rock Wall,2010
5469,5469,US,"Mango, presumably, is the dog pictured on the label. This is a heavily-extracted, somewhat bitter Merlot, with fruit flavors of blackberry syrup, alcohol at 15%, and still a fair amount of green bitterness to the tannins. Notes of iodine and anise come into play in the finish.",Mango's Vineyard,86,22.0,Washington,Columbia Valley (WA),Columbia Valley,Paul Gregutt,@paulgwine ,Passion Vineyards 2009 Mango's Vineyard Merlot (Columbia Valley (WA)),Merlot,Passion Vineyards,2009
5479,5479,US,"Released young, this fresh and citrusy wine is all about the fruit. Full in the mouth, it quickly settles into a cherry vanilla mid-palate, and sails on through a clean finish.",Whole Cluster Fermented,86,22.0,Oregon,Willamette Valley,Willamette Valley,Paul Gregutt,@paulgwine ,Willamette Valley Vineyards 2011 Whole Cluster Fermented Pinot Noir (Willamette Valley),Pinot Noir,Willamette Valley Vineyards,2011
5482,5482,US,"The 2010 Sauce is three quarters Merlot, with Syrah and Malbec filling in the rest. It's a simple, accessible red blend, with accents of cut tobacco over black cherry fruit.",Sauce,86,12.0,Washington,Columbia Valley (WA),Columbia Valley,Paul Gregutt,@paulgwine ,Zero One Vintners 2010 Sauce Red (Columbia Valley (WA)),Red Blend,Zero One Vintners,2010
5494,5494,US,"Aromatic with crushed rock, raspberry, cranberry and hints of clove, this well-structured wine—53% Cabernet Sauvignon, 16% Merlot, 21% Cabernet Franc and 10% Petit Verdot—will reward additional bottle age. The young, tart red fruits are steely and precise, the barrel influence perfectly balanced against the natural acidity.",Seven Hills Vineyard,93,60.0,Washington,Walla Walla Valley (WA),Columbia Valley,Paul Gregutt,@paulgwine ,Pepper Bridge 2011 Seven Hills Vineyard Red (Walla Walla Valley (WA)),Bordeaux-style Red Blend,Pepper Bridge,2011
5508,5508,US,"For the first time this reserve-level Gamache Cabernet includes grapes from the Ciel du Cheval vineyard as well as both the Champoux and estate vineyards. It's 100% varietal, drawing upon equal portions of fruit from all three, and it's a magnificent combination. Powerful, sleek, dense and textural, the wine explodes from the glass, muscular and thick with black fruits and ripe tannins. Highlights of black tea, espresso and smoke add layers of interest to a lengthy finish.",Reserve,93,55.0,Washington,Columbia Valley (WA),Columbia Valley,Paul Gregutt,@paulgwine ,Gamache 2010 Reserve Cabernet Sauvignon (Columbia Valley (WA)),Cabernet Sauvignon,Gamache,2010
5516,5516,US,"Modest citrus, earth and almond notes come up from the glass, and continue in the flavors of this smooth, rounded, and straightforward wine. The balance is on the soft side, and the body is quite light.",Hybrid,83,10.0,California,Lodi,Central Valley,Jim Gordon,@gordone_cellars,Peltier 2013 Hybrid Sauvignon Blanc (Lodi),Sauvignon Blanc,Peltier,2013
5527,5527,US,"Earthy, vegetal aromas and equally earthy, peppery flavors make this wine unusually rustic. It does have traces of good aged character, like leather and tea.",Under the Sea,82,22.0,California,Lodi,Central Valley,Jim Gordon,@gordone_cellars,Ripken 2011 Under the Sea Primitivo (Lodi),Primitivo,Ripken,2011
5557,5557,US,"Yes, this does not shy away from the herbal bite often found in Oregon Pinot. But that accent is nicely integrated into a firm, balanced wine with penetrating red fruits and darker notes of black coffee, black licorice and a whiff of fresh truffle.",Reserve,90,32.0,Oregon,Willamette Valley,Willamette Valley,Paul Gregutt,@paulgwine ,Illahe 2008 Reserve Pinot Noir (Willamette Valley),Pinot Noir,Illahe,2008
5582,5582,US,"With its aromas of citrus and honey and its exuberant flavors of tropical fruit and toasted spice, this is both pretty and playful. Sweet but full of finesse, the wine has floral element that adds to its allure.",Ice,87,22.0,New York,Finger Lakes,Finger Lakes,Susan Kostrzewa,@suskostrzewa,Wagner 2006 Ice Vidal Blanc (Finger Lakes),Vidal Blanc,Wagner,2006
5590,5590,US,"This is a perfectly drinkable wine, with good fruit from a great vineyard. It's a bit minty and chalky; let's say rustic. The mixed flavors border on the lightly vegetal side of cool-climate fruit; not sweet but firm.",Ciel du Cheval Vineyard,86,25.0,Washington,Red Mountain,Columbia Valley,Paul Gregutt,@paulgwine ,Andrew Will 2005 Ciel du Cheval Vineyard Sangiovese (Red Mountain),Sangiovese,Andrew Will,2005
5600,5600,US,"Among the single-vineyard 2008 Pinots from Rex Hill, this is the lightest in flavor and style. Ripe strawberry fruit, medium-bodied, is buttressed with generous natural acidity. Highlights of fresh-cut herbs dot the finish.",Alloro Vineyard,88,52.0,Oregon,Chehalem Mountains,Willamette Valley,Paul Gregutt,@paulgwine ,Rex Hill 2008 Alloro Vineyard Pinot Noir (Chehalem Mountains),Pinot Noir,Rex Hill,2008
5603,5603,US,"For $9 a nice wine in a nice package, made from old-vine Zinfandel from Lodi. The red fruit on the nose pops out pleasantly followed by smooth tannins and a fruity, chocolaty mix of flavors.","Take Flight, Artists Collection Limited Edition",88,9.0,California,Lodi,Central Valley,Virginie Boone,@vboone,"Salvatore Principe 2009 Take Flight, Artists Collection Limited Edition Zinfandel (Lodi)",Zinfandel,Salvatore Principe,2009
5637,5637,US,"The estate reserve is simply a barrel selection that the winery feels represents the top 10% of their estate-grown Pinot Noir. Basically it offers quite similar flavors; for the extra money you get more butterfat, more cherry fruit and a little less herb. What it gains in power, the wine loses in detail and nuance; depending upon your own palate preferences, the regular estate might be the better value.",Estate Reserve,90,45.0,Oregon,Willamette Valley,Willamette Valley,Paul Gregutt,@paulgwine ,Apolloni 2006 Estate Reserve Pinot Noir (Willamette Valley),Pinot Noir,Apolloni,2006
5653,5653,US,"This wine has that wonderful but hard-to-pin-down Zinfandel essence that's extremely fruity but also uniquely spicy and brambly. It blends together ripe raspberry, creamy vanilla and red cherry on a smooth, nicely viscous and very full-bodied frame that helps the finish linger.",Big Wood Zin,90,32.0,California,Livermore Valley,Central Coast,Jim Gordon,@gordone_cellars,Wood Family Vineyards 2014 Big Wood Zin Zinfandel (Livermore Valley),Zinfandel,Wood Family Vineyards,2014
