,Unnamed: 0,country,description,designation,points,price,province,region_1,region_2,taster_name,taster_twitter_handle,title,variety,winery,Wine Year
7722,7722,US,"This wine opens with just a touch of reduction followed by quite pure aromas of red and blue fruit. The flavors are sweet and fresh, with the tannins bringing a light grip.",The Velvet Devil,88,12.0,Washington,Washington,Washington Other,Sean P. Sullivan,@wawinereport,Charles Smith 2014 The Velvet Devil Merlot (Washington),Merlot,Charles Smith,2014
7731,7731,US,"Tons of candied grape and lilac aromas show on the nose of this rather aged blend of 60% Grenache, 30% Syrah and 10% Mourvèdre, with root beer and blueberry-sorbet notes. The palate offers a similar array of sweet dark fruit, but the tannic structure and acidity clean it up nicely.",Paso Rouge Alto Pomar Vineyard Estate,88,25.0,California,Paso Robles,Central Coast,Matt Kettmann,@mattkettmann,DENO 2008 Paso Rouge Alto Pomar Vineyard Estate G-S-M (Paso Robles),G-S-M,DENO,2008
7737,7737,US,"Coming from a site best known for its Syrah, this wine offers aromas of berry compote, funk and potpourri. The palate shows a pleasing sense of purity, with lightly astringent tannins providing a bit of distraction.",Boushey Vineyard,88,35.0,Washington,Yakima Valley,Columbia Valley,Sean P. Sullivan,@wawinereport,Telaya 2014 Boushey Vineyard Cabernet Sauvignon (Yakima Valley),Cabernet Sauvignon,Telaya,2014
7739,7739,US,"This is an earthy, stemmy wine, hugely concentrated and ripe in strawberry and rhubarb. Subtle in texture and bite, it shows a streak of cardamom on the finish.",Porter and Plot,88,42.0,California,Sonoma Coast,Sonoma,Virginie Boone,@vboone,Winc 2014 Porter and Plot Pinot Noir (Sonoma Coast),Pinot Noir,Winc,2014
7746,7746,US,"Vibrant aromas of lychee, white flowers and spice give way to off-dry fruit flavors, with the concentration seeming a bit light. Still, it delivers a lot of appeal.",Twin Vineyards,88,16.0,Washington,Yakima Valley,Columbia Valley,Sean P. Sullivan,@wawinereport,Pacific Rim 2015 Twin Vineyards Gewürztraminer (Yakima Valley),Gewürztraminer,Pacific Rim,2015
7748,7748,US,"Juicy in smoked cherry and a thick, velvety texture, this luxuriously pretty wine blends several estate blocks and clones. Forest floor, cola, clove, pine and black cherry highlight an integrated approach. It stays balanced and complex through a lengthy finish that further accentuates the spice.",Estate,91,50.0,California,Green Valley,Sonoma,Virginie Boone,@vboone,Iron Horse 2014 Estate Pinot Noir (Green Valley),Pinot Noir,Iron Horse,2014
7750,7750,US,"Super earthy, this wine shows pomegranate, rhubarb and a touch of smoke, the aromas perfumed in rose petal. Medium bodied, it's balanced and elegant, with a streak of natural, lifted acidity.",Charisma,91,60.0,California,Napa Valley,Napa,Virginie Boone,@vboone,Levendi 2014 Charisma Pinot Noir (Napa Valley),Pinot Noir,Levendi,2014
7751,7751,US,"Caramel-laced buttercream, marshmallow, cotton candy and sweet almond milk show on the nose of this bottling, named after one of Bill Foley's daughters. It's fairly light in body on the sprightly palate, where burnt marshmallow and vanilla flavors reign over the citrus elements.",Courtney's,91,35.0,California,Sta. Rita Hills,Central Coast,Matt Kettmann,@mattkettmann,Lincourt 2014 Courtney's Chardonnay (Sta. Rita Hills),Chardonnay,Lincourt,2014
7755,7755,US,"Cabernet Sauvignon (54%) takes the lead on this blend, followed by Merlot (23%), Cabernet Franc (13%), Malbec (6%) and Petit Verdot. Aromas of fresh herb, flower, pencil lead, cherry jam and spice lead to light tart, fresh fruit flavors. The tannins bring a bit of grip and dryness that hopefully smooths out with some additional time in the bottle but it has the stuffing to go the distance.",Claret,91,35.0,Washington,Columbia Valley (WA),Columbia Valley,Sean P. Sullivan,@wawinereport,Matthews 2014 Claret Red (Columbia Valley (WA)),Bordeaux-style Red Blend,Matthews,2014
7756,7756,US,"Brawny in tannin weight and grip, this tight-knit wine is impressively built and in tune with the vintage and its embrace of strength and complexity. Chalky texture is highlighted in tart mountain cherry, graphite and vanilla laced in clove. Enjoy best 2023–2033.",Animo,91,85.0,California,Napa Valley,Napa,Virginie Boone,@vboone,Michael Mondavi Family Estate 2013 Animo Cabernet Sauvignon (Napa Valley),Cabernet Sauvignon,Michael Mondavi Family Estate,2013
7757,7757,US,"One of three Chardonnays named after the winemaker's daughters, the aromas draw you into the glass, with notes of lees, almond, melted butter, cream, peach and spice. All Clone 95, the tropical-fruit flavors are sweet, rich and layered. A touch of heat on the finish is the only thing that holds it back.",Amylla Loren,91,45.0,Washington,Columbia Valley (WA),Columbia Valley,Sean P. Sullivan,@wawinereport,Morell-Peña 2015 Amylla Loren Chardonnay (Columbia Valley (WA)),Chardonnay,Morell-Peña,2015
7760,7760,US,"This wine is a blend of Cabernet Sauvignon (67%), Merlot (26%) and Cabernet Franc. It's aromatically expressive, with notes of raspberry, cigar box, mint, café au lait, blackberry, dried herb, anise and wet gravel. The palate displays a sense of elegance and refinement that captures the attention, with red-fruit flavors lingering on the long (slightly warm) finish.",Fianchetto Xl Vineyard,91,95.0,Washington,Walla Walla Valley (WA),Columbia Valley,Sean P. Sullivan,@wawinereport,Rasa 2013 Fianchetto Xl Vineyard Red (Walla Walla Valley (WA)),Bordeaux-style Red Blend,Rasa,2013
7761,7761,US,"This is a single vineyard, 100% varietal wine, aged in 70% new French oak. It draws you into the glass, with notes of char, fig, blackberry, spice and coffee. The dark-roasted coffee and dark-fruit flavors show precision and detail, lingering on the finish. The wood is primary at present but should integrate with time.",For the Love of the Game,91,95.0,Washington,Horse Heaven Hills,Columbia Valley,Sean P. Sullivan,@wawinereport,Rasa 2014 For the Love of the Game Cabernet Sauvignon (Horse Heaven Hills),Cabernet Sauvignon,Rasa,2014
7762,7762,US,"Light and spicy, this wine surprises and delights. It shows a tannic underbrush of firmness and grit that's seasoned in tart acidity and flavors of rhubarb, currant and black tea. It's well balanced and enjoyable now.",Gunsalus Vineyard,91,38.0,California,Green Valley,Sonoma,Virginie Boone,@vboone,Ron Rubin 2014 Gunsalus Vineyard Pinot Noir (Green Valley),Pinot Noir,Ron Rubin,2014
7763,7763,US,"Floral and fleshy, this is a big-boned, concentrated wine. A ripe rendering of apple, pear and peach is spiked in intriguing seasonings of lemongrass and nutmeg.",Sangiacomo Green Acres Catarina Clone 4,91,48.0,California,Carneros,Napa-Sonoma,Virginie Boone,@vboone,Saintsbury 2015 Sangiacomo Green Acres Catarina Clone 4 Chardonnay (Carneros),Chardonnay,Saintsbury,2015
7767,7767,US,"High-toned aromas of blackberry, aniseed, macerated cranberry, motor oil and flower lead to rich full-bodied cranberry and blackberry flavors that bring a sense of hedonism.",StevensBlackTongue,91,32.0,Washington,Yakima Valley,Columbia Valley,Sean P. Sullivan,@wawinereport,Stevens 2014 StevensBlackTongue Syrah (Yakima Valley),Syrah,Stevens,2014
7769,7769,US,"This blend of 45% Sangiovese, 20% Merlot, 20% Cabernet Sauvignon, 5% Cabernet Franc, 5% Petit Verdot and 5% Freisa is very approachable and food-friendly, showing baked black-cherry pie, star anise and pine resin on the nose. The palate dries up with red plum and flashes of strawberry set against shaved clove spices. It's layered in flavor but softly textured.",Classico,91,24.0,California,Santa Barbara County,Central Coast,Matt Kettmann,@mattkettmann,Toccata 2013 Classico Red (Santa Barbara County),Red Blend,Toccata,2013
7777,7777,US,"This is the third of three Chardonnays named after the winemaker's daughters. The aromas bring notes of clarified butter, lees, spice, pear, pineapple and other tropical fruit. The flavors are rich but still show restraint, with a lightly creamy feel and a long finish.",Gemma Camaryn,91,45.0,Washington,Columbia Valley (WA),Columbia Valley,Sean P. Sullivan,@wawinereport,Morell-Peña 2015 Gemma Camaryn Chardonnay (Columbia Valley (WA)),Chardonnay,Morell-Peña,2015
7778,7778,US,"This Willow Creek district winery delivers a powerful blend of 71% Grenache, 19% Syrah, 9% Mourvèdre and 1% Viognier. It offers aromas of black licorice, black cherry and elderberry, with roasted meat in the background. It's very rich, bursting with flavors of blackberry and balsamic vinegar that evolve toward creosote and tar, all wrapped up in silky tannins.",WCS Jack John,92,75.0,California,Paso Robles,Central Coast,Matt Kettmann,@mattkettmann,Jada Vineyard & Winery 2012 WCS Jack John Red (Paso Robles),Rhône-style Red Blend,Jada Vineyard & Winery,2012
7783,7783,US,"Michael Gill goes for broke booze-wise on this hot number, but the rewards are worth the risk. Aromas of blueberry, mint, graphite, dried cherry, lilac and graphite get a sagebrush lift. On the palate, distinct black licorice accompany blackberry syrup and white pepper. There's a slight bit of alcoholic burn on the finish, but it doesn't drink as hot as you'd guess.",Black Tie,92,70.0,California,Paso Robles,Central Coast,Matt Kettmann,@mattkettmann,Michael Gill Cellars 2012 Black Tie Syrah (Paso Robles),Syrah,Michael Gill Cellars,2012
7789,7789,US,"Light golden brown in color, this richly aromatic wine offers notes of brown sugar, dried pineapple, papaya and lychee. A whopping 270.8g/L residual sugar, it's thick, honeyed and sugary sweet with cinnamon, honey and granulated brown sugar flavors that linger on the finish.",Estate Grown Late Harvest,92,35.0,Washington,Columbia Valley (WA),Columbia Valley,Sean P. Sullivan,@wawinereport,Gordon Estate 2012 Estate Grown Late Harvest Gewürztraminer (Columbia Valley (WA)),Gewürztraminer,Gordon Estate,2012
7797,7797,US,"Coming from one of the state's top Syrah sites, this wine dazzles the senses with notes of freshly roasted coffee, char, dark plum and sweet spices. It's medium bodied with thoroughly delicious coffee flavors backed by a soft feel.",Les Collines Vineyard,92,30.0,Washington,Walla Walla Valley (WA),Columbia Valley,Sean P. Sullivan,@wawinereport,J & J 2012 Les Collines Vineyard Syrah (Walla Walla Valley (WA)),Syrah,J & J,2012
7810,7810,US,"The best of Glen Fiona's current releases, this displays cool-climate varietal character, with mountain berry fruit, herb, spice, tar and a streak of licorice.",Basket Press,87,15.0,Washington,Columbia Valley (WA),Columbia Valley,Paul Gregutt,@paulgwine ,Glen Fiona 2006 Basket Press Syrah (Columbia Valley (WA)),Syrah,Glen Fiona,2006
7821,7821,US,"Pure Cabernet Sauvignon, young and fruity, with tart berry and bitter herb. The light but slightly green tannins add some useful counterpoint to the cherry pop fruit, giving the wine a more substantial palate impression and length in the finish.",Steak House,87,13.0,Washington,Columbia Valley (WA),Columbia Valley,Paul Gregutt,@paulgwine ,Magnificent Wine Company 2008 Steak House Cabernet Sauvignon (Columbia Valley (WA)),Cabernet Sauvignon,Magnificent Wine Company,2008
7823,7823,US,"This budget wine has sweet fruit and soft tannins, along with surprising concentration and length. Offsetting a hint of stemminess are generous, varietally true flavors, and a rich, meaty nose that suggests beef and coffee. Best Buy. —P.G.",Grand Estates,87,11.0,Washington,Columbia Valley (WA),Columbia Valley,Paul Gregutt,@paulgwine ,Columbia Crest 1999 Grand Estates Merlot (Columbia Valley (WA)),Merlot,Columbia Crest,1999
7850,7850,US,"Black cherry, clove and smoked meat aromas are rolled up into one wondrously savory scent in this 50-50 blend of Mourvèdre and Syrah. Flavors of beef roasted in blackberry and Sherry sauce sprinkled with oregano and marjoram entertain the complex palate.",Ardor,94,40.0,California,Paso Robles,Central Coast,Matt Kettmann,@mattkettmann,II Moons 2011 Ardor Red (Paso Robles),Rhône-style Red Blend,II Moons,2011
7853,7853,US,"Coming from a vineyard west of Paso Robles that peeks at the ocean surrounding Morro Rock, this is a dense expression of the grape, with dried strawberries, blackberries, smoked pork butt, star anise and lots of smoke on the nose. The palate is rich and lively, with decent mineral-driven restraint, showing a mouth-watering flavor array of dense blackberries and spicy Sichuan peppercorns.",Barrel Select,94,58.0,California,San Luis Obispo County,Central Coast,Matt Kettmann,@mattkettmann,Asuncion Ridge 2012 Barrel Select Pinot Noir (San Luis Obispo County),Pinot Noir,Asuncion Ridge,2012
7854,7854,US,"Made by Kirk Venge from a Dutton Ranch vineyard site, this wine immediately offers a lot to like, from its earthy sassafras and compelling layers of crisp raspberry and cherry, to its soft layers of oaky density accented in rose. Requiring more time to open, with an ideal cellaring through 2023, it finishes with a flair of cedar and vanilla, lasting long on the palate.",Manzana Vineyard,94,68.0,California,Russian River Valley,Sonoma,Virginie Boone,@vboone,B Cellars 2013 Manzana Vineyard Pinot Noir (Russian River Valley),Pinot Noir,B Cellars,2013
7857,7857,US,"A proprietary blend of 57% Merlot, 35% Cabernet Sauvignon and 8% Petit Verdot, all homegrown, this is dense and powerful, rich in red fruit but also savory in tobacco, black tea and leather. Reflective of the appellation's ability to combine power with elegance, it fully represents and should continue to meld beautifully together in the cellar. Drink now through 2022.",Elevage Estate Grown,94,96.0,California,Stags Leap District,Napa,Virginie Boone,@vboone,Chimney Rock 2012 Elevage Estate Grown Red (Stags Leap District),Bordeaux-style Red Blend,Chimney Rock,2012
7860,7860,US,"This reserve-level wine is down to just three barrels in this vintage. It's creamy and yet precisely defined, with generous layers of pineapple, lime, golden apple and lemon tea. A bracing minerality underscores gently oaked, finishing notes of melba toast and almond butter.",Édition Limitée,94,65.0,Oregon,Dundee Hills,Willamette Valley,Paul Gregutt,@paulgwine ,Domaine Drouhin Oregon 2013 Édition Limitée Chardonnay (Dundee Hills),Chardonnay,Domaine Drouhin Oregon,2013
7863,7863,US,"Planted in 1999 specifically for the producer, this vineyard block provides power and structure, revealing shocks of blackberry jam, mocha and gunpowder amidst a streak of wild anise and black pepper. Robust and bold, it begs for another 10 to 15 years in the cellar before finding its complete composure.",Stagecoach Vineyard The Biale Block,94,50.0,California,Napa Valley,Napa,Virginie Boone,@vboone,Robert Biale 2013 Stagecoach Vineyard The Biale Block Zinfandel (Napa Valley),Zinfandel,Robert Biale,2013
7868,7868,US,"From a three-acre vineyard, this wine accented in 2% Petit Verdot offers a sense of gravel underneath the dark, syrupy plum and leathery tannin structure. Midway through, it exhibits cherry, raspberry and vanilla, showing a juicy underbelly that should develop further over time. Drink now through 2022.",Agira Vineyard,94,80.0,California,Diamond Mountain District,Napa,Virginie Boone,@vboone,Von Strasser 2012 Agira Vineyard Cabernet Sauvignon (Diamond Mountain District),Cabernet Sauvignon,Von Strasser,2012
7870,7870,US,"From the producer's oldest hillside vineyard, planted in 1967, comes this gem of a wine, a taste of cinnamon toast and black currant. Layered acidity forms a backbone against which concentrated flavors of graham cracker and dark chocolate lie, the finish long and deep. It's built to age, enjoy now through 2025.",Spaulding Vineyard,94,80.0,California,Diamond Mountain District,Napa,Virginie Boone,@vboone,Von Strasser 2012 Spaulding Vineyard Cabernet Sauvignon (Diamond Mountain District),Cabernet Sauvignon,Von Strasser,2012
7872,7872,US,"Voluptuously tropical in shaved coconut and silky layers of peach and pear, this is a complex, age-worthy white from a stellar vineyard site, a knockout version of the variety. Smooth and round, it maintains a core of acidity that buoys the experience, finishing with a flourish. Drink now through 2022.",Ulises Valdez Vineyard,94,70.0,California,Russian River Valley,Sonoma,Virginie Boone,@vboone,Paul Hobbs 2012 Ulises Valdez Vineyard Chardonnay (Russian River Valley),Chardonnay,Paul Hobbs,2012
7874,7874,US,"Creamy brie rind aromas mesh with scratched yellow grapefruit skin and a steely minerality on the nose of this small-batch bottling from a winery atop the appellation's ridgeline. Light and focused flavors of kumquat juice, iodine and lime skin satisfy the palate, and would be a perfect match for shellfish.",Albutom Vineyard,94,70.0,California,Santa Cruz Mountains,Central Coast,Matt Kettmann,@mattkettmann,Thomas Fogarty 2012 Albutom Vineyard Chardonnay (Santa Cruz Mountains),Chardonnay,Thomas Fogarty,2012
7876,7876,US,"One of the appellation's more famous wines, this opens in black licorice and blackberry, alongside a streak of malted chocolate, soft and sinewy, with a tension of acidity that adds age-worthy structure. Dense and interesting now, it'll get better over time, cellaring well through 2027.",Georges de Latour Private Reserve,94,145.0,California,Napa Valley,Napa,Virginie Boone,@vboone,Beaulieu Vineyard 2012 Georges de Latour Private Reserve Cabernet Sauvignon (Napa Valley),Cabernet Sauvignon,Beaulieu Vineyard,2012
7879,7879,US,"This collaboration between American winemakers Greg Brewer and Steve Clifton and Japanese entrepreneur Takahide Sugimoto is stunningly high-toned and buttoned-up at first, with sour cream, yogurt, crushed ant, gunmetal, flint and quinine elements on the nose. The palate is complex and fascinating, with chalk and cement minerality bolstered by lime blossom, kumquat and tonic that opens graciously with time. Drink 2016–2026.",Samurai,94,58.0,California,Sta. Rita Hills,Central Coast,Matt Kettmann,@mattkettmann,Ch.igai Takaha 2013 Samurai Chardonnay (Sta. Rita Hills),Chardonnay,Ch.igai Takaha,2013
7890,7890,US,"The Fusion in question is the blend—an unusual combination of 61% Pinot Noir, 21% Syrah and 18% Merlot. Some tasters will find it works well as an everyday, all-purpose red. The jumble of red fruits is matched to a strong streak of vanilla, with some stemmy flavors coming up in the tannins.",Pinot Fusion,84,18.0,Oregon,Oregon,Oregon Other,Paul Gregutt,@paulgwine ,Sweet Cheeks 2012 Pinot Fusion Red (Oregon),Red Blend,Sweet Cheeks,2012
7904,7904,US,"This wine seems to be a casualty of the cold vintage, with thin fruit and overall earthy flavors. A whiff of barnyard is evident as well.",Zenith Vineyard,84,36.0,Oregon,Eola-Amity Hills,Willamette Valley,Paul Gregutt,@paulgwine ,Grochau 2011 Zenith Vineyard Pinot Noir (Eola-Amity Hills),Pinot Noir,Grochau,2011
7908,7908,US,This smoky Zinfandel is aromatically closed off and still tight in tannic formation. Give it time to open and it'll share meaty black-fruit and tar.,Old Vine,84,24.0,California,Lodi,Central Valley,Virginie Boone,@vboone,Stama 2011 Old Vine Zinfandel (Lodi),Zinfandel,Stama,2011
7911,7911,US,"A majority varietal, a dying breed in the Napa Valley, this also has 5% Petite Sirah. The combination is dense and syrupy in strawberry and a tightness of oak. Time will soften its edges, and there's already a softness to the tannins that delights, the finish light and lean. Cellar through 2017.",Estate,90,39.0,California,Napa Valley,Napa,Virginie Boone,@vboone,Tofanelli Family 2012 Estate Charbono (Napa Valley),Charbono,Tofanelli Family,2012
7922,7922,US,"Dense and concentrated, this smoothly rounded wine is well integrated and robust in oak and black cherry, a nice representation of estate grapes. With a strong presence of tannins, it needs to breathe before being enjoyed with earthy fare.",Estate Reserve,90,40.0,California,Carneros,Napa-Sonoma,Virginie Boone,@vboone,Artesa 2013 Estate Reserve Pinot Noir (Carneros),Pinot Noir,Artesa,2013
7923,7923,US,"Faint aromatics hide an effusiveness on the palate of thick, dense blackberry jam and brown sugar, the ripe power of the wine kept in check by a balance of acidity. Fuller bodied in style, it remains dry and vibrant on the finish.",Old Vines,90,35.0,California,Calistoga,Napa,Virginie Boone,@vboone,August Briggs 2012 Old Vines Zinfandel (Calistoga),Zinfandel,August Briggs,2012
7930,7930,US,"Yellow skinned and Asian pears, jasmine flowers, lemon slices and a slight petrol note entertain the nose on this single-vineyard bottling from a part of the Parker family's estate that was planted in 1989. The palate is quite balanced between flavors of lemon-lime soda, tangerine juice and limestone minerality.",Rodney's Vineyard,90,24.0,California,Santa Barbara County,Central Coast,Matt Kettmann,@mattkettmann,Fess Parker 2013 Rodney's Vineyard Riesling (Santa Barbara County),Riesling,Fess Parker,2013
7942,7942,US,"This affordable blend of all five Bordeaux grapes is a solid second wine, produced from barrels cut from the winery's other bottlings. It hits 14.5% alcohol but remains reasonably well balanced, with just a touch of heat. It's dark and smoky, with plenty of barrel flavors. Cherry liqueur, smoke, caramel and espresso—it gives you a lot of power for the price.",Little Bear Creek Red Wine,88,20.0,Washington,Columbia Valley (WA),Columbia Valley,Paul Gregutt,@paulgwine ,Woodinville Wine Cellars 2005 Little Bear Creek Red Wine Red (Columbia Valley (WA)),Red Blend,Woodinville Wine Cellars,2005
7958,7958,US,"This blend of 46% Cabernet Sauvignon, 37% Syrah and 17% Petit Verdot retains a reductive quality on the nose even after being opened for quite a while, with slightly funky blackberry and burnt cedar aromas. Dried blackberries and black cherries show on the palate, but the tarry sensation permeates throughout.",The Big Game,86,75.0,California,Paso Robles,Central Coast,Matt Kettmann,@mattkettmann,The Farm Winery 2011 The Big Game Red (Paso Robles),Red Blend,The Farm Winery,2011
7964,7964,US,"Full of vanilla and nougat aromas, this has a creamy texture, almost-sweet flavors and soft texture. Fermented in stainless steel and only 15% aged in oak, it's practically a pastry in a glass.",Light Horse,86,15.0,California,California,California Other,Jim Gordon,@gordone_cellars,Jamieson Ranch 2013 Light Horse Chardonnay (California),Chardonnay,Jamieson Ranch,2013
7976,7976,US,"Rich, tannic and brambly, a juiciness of blackberry jam forms the substantive core of this wine, made in larger quantities for larger distribution. The finish is leathery and well integrated in oak.",Reserve,86,20.0,California,Dry Creek Valley,Sonoma,Virginie Boone,@vboone,Frei Brothers 2013 Reserve Zinfandel (Dry Creek Valley),Zinfandel,Frei Brothers,2013
7980,7980,US,"Very ripe fruit aromas and flavors in this wine resemble dried plums and cherries. The texture feels broad and smooth, with enough firm tannins to give it some grip on the palate. It tastes full bodied and a bit exotic, with some anise and black pepper to enhance the dried-fruit notes.",Especial,86,52.0,California,Livermore Valley,Central Coast,Jim Gordon,@gordone_cellars,Wood Family Vineyards 2012 Especial Cabernet Sauvignon (Livermore Valley),Cabernet Sauvignon,Wood Family Vineyards,2012
7983,7983,US,"This straightforward wine has notes of fresh apple and pear. The flavors are light in style, seeming a bit dilute.",Unoaked,85,15.0,Washington,Columbia Valley (WA),Columbia Valley,Sean P. Sullivan,@wawinereport,Kamiak 2014 Unoaked Chardonnay (Columbia Valley (WA)),Chardonnay,Kamiak,2014
8034,8034,US,"Here is a tasty, light-bodied Zin with its own style and a great price. It has a minty, eucalyptus aroma and vivid raspberry flavors, almost sweet in balance. Medium-bodied, it delivers a lingering fruity finish.",Family Reserve,86,8.0,California,California,California Other,Jim Gordon,@gordone_cellars,Oak Grove 2012 Family Reserve Zinfandel (California),Zinfandel,Oak Grove,2012
8037,8037,US,"Sharp, pungent grass scents and a bit of rough citrus form the nose. Once sipped, thin and brisk apple cider flavors get help from slight kiwi and fresh acidity. Serve with bay scallop salad.",Tiradora,86,28.0,California,Santa Ynez Valley,Central Coast,Matt Kettmann,@mattkettmann,Refugio Ranch 2011 Tiradora Sauvignon Blanc (Santa Ynez Valley),Sauvignon Blanc,Refugio Ranch,2011
8042,8042,US,"This Bordeaux-style white blend is 60% Sauvignon Blanc and 40% Sémillon. It carries a hint of sweetness, possibly some residual sugar above threshhold level. Flavors of butter cookie accompany simple, light yellow fruits.",96 Cedars,86,18.0,Washington,Columbia Valley (WA),Columbia Valley,Paul Gregutt,@paulgwine ,Auclair 2013 96 Cedars White (Columbia Valley (WA)),Bordeaux-style White Blend,Auclair,2013
8044,8044,US,"This Syrah is done in a surprisingly soft style, with light, peppery, rather pale fruit flavors. It's pleasant, but not a typical representative of the grape's usual power.",Estate,86,40.0,Washington,Walla Walla Valley (WA),Columbia Valley,Paul Gregutt,@paulgwine ,Walla Faces 2012 Estate Syrah (Walla Walla Valley (WA)),Syrah,Walla Faces,2012
8052,8052,US,"A boisterous, easy-drinking red wine that gushes ripe fruit and sweet oak aromas. It tastes almost sweet, like blackberry jam, and seems soft-textured in spite of its full body.",Dante's Inferno,86,31.0,California,California,California Other,Jim Gordon,@gordone_cellars,Dante Robere 2012 Dante's Inferno Red (California),Rhône-style Red Blend,Dante Robere,2012
8053,8053,US,"This unoaked Chardonnay is awash in green apple, tart lemon and tropical pineapple, light and lifted on the palate. It goes down easily, and will track well at the table. Salads, seafood and brunch-type fare are all good bets.",Unoaked,86,18.0,California,Sonoma County,Sonoma,Virginie Boone,@vboone,Dealy Lane 2012 Unoaked Chardonnay (Sonoma County),Chardonnay,Dealy Lane,2012
